{
  "schema_version": "ats.policy_snapshot.v1",
  "snapshot_id": "policy-fixture-draft2",
  "standard": "ATS-1",
  "spec_version": "1.0.0-draft.2",
  "created_at": "2026-08-07T00:00:00Z",
  "profiles": [
    "ASSESS",
    "SPECIFY",
    "TRANSFORM"
  ],
  "audience": {
    "expertise": "expert",
    "audience_id": "draft2-fixture-audience",
    "locale": "en-US"
  },
  "glossary_refs": [
    "arq-core-v1"
  ],
  "lexicon_refs": [
    "ats_force_lexicon_v1"
  ],
  "rule_overrides": {},
  "exceptions": [],
  "finding_budget": {
    "guardrail": "all_critical",
    "coach": 5
  },
  "model_artifacts": [],
  "fallback_policy": "fail_closed",
  "snapshot_sha256": "e4fd09018c93376e090432a476e5eead72c97da71f257bc1670f96e25eba3988"
}
