{
  "schema_version": "ats.policy_snapshot.v1",
  "snapshot_id": "policy-fixture-strengthened",
  "standard": "ATS-1",
  "spec_version": "1.0.0-draft.1",
  "created_at": "2026-08-03T00:00:00Z",
  "profiles": [
    "ASSESS"
  ],
  "audience": {
    "expertise": "expert",
    "audience_id": "arq-engineering",
    "locale": "en-US"
  },
  "glossary_refs": [
    "arq-core-v1"
  ],
  "lexicon_refs": [
    "ats_force_lexicon_v1"
  ],
  "rule_overrides": {
    "ATS-DISC-001": "required"
  },
  "exceptions": [],
  "finding_budget": {
    "guardrail": "all_critical",
    "coach": 5
  },
  "model_artifacts": [],
  "fallback_policy": "fail_closed",
  "snapshot_sha256": "8dcf270327dcef17e7175c955e77f19841a05a0d72fcc7afdfeaffceed584ed8"
}
