{
  "schema_version": "ats.policy_snapshot.v1",
  "snapshot_id": "policy-fixture-composed",
  "standard": "ATS-1",
  "spec_version": "1.0.0-draft.1",
  "created_at": "2026-08-03T00:00:00Z",
  "profiles": [
    "ASSESS",
    "SPECIFY",
    "TRANSFORM"
  ],
  "audience": {
    "expertise": "expert",
    "audience_id": "arq-engineering",
    "locale": "en-US"
  },
  "glossary_refs": [
    "arq-core-v1"
  ],
  "lexicon_refs": [
    "ats_force_lexicon_v1"
  ],
  "rule_overrides": {},
  "exceptions": [],
  "finding_budget": {
    "guardrail": "all_critical",
    "coach": 5
  },
  "model_artifacts": [],
  "fallback_policy": "fail_closed",
  "snapshot_sha256": "d57dd5240beb516753f7e0dcbe52b2e65a3b9470f6af2e30839fbe3d53708116"
}
