{
  "schema_version": "ats.policy_snapshot.v1",
  "snapshot_id": "policy-example-assess",
  "snapshot_sha256": "28b81131b9dc6fcd700fef5732bec912b5244345dc5856217f0f30b881570255",
  "standard": "ATS-1",
  "spec_version": "1.0.0-draft.1",
  "created_at": "2026-08-02T22:00:00Z",
  "profiles": [
    "ASSESS",
    "TRANSFORM"
  ],
  "audience": {
    "expertise": "expert",
    "audience_id": "arq-engineering",
    "locale": "en-US"
  },
  "glossary_refs": [
    "arq-core-v1"
  ],
  "lexicon_refs": [
    "ats_force_lexicon_v1"
  ],
  "rule_overrides": {
    "ATS-DISC-001": "advisory"
  },
  "exceptions": [],
  "finding_budget": {
    "guardrail": "all_critical",
    "coach": 5
  },
  "model_artifacts": [
    {
      "name": "arqtext-router",
      "version": "0.1.0",
      "sha256": "1111111111111111111111111111111111111111111111111111111111111111",
      "provider": "local"
    },
    {
      "name": "arqtext-critic",
      "version": "0.1.0",
      "sha256": "2222222222222222222222222222222222222222222222222222222222222222",
      "provider": "local"
    }
  ],
  "fallback_policy": "fail_closed"
}
